{
  "status": "ok",
  "created_at": "2026-06-03T06:08:26Z",
  "rules_manifest": "network_extension_steering_rules_lab.json",
  "case_count": 13,
  "cases": [
    {
      "name": "matched_postgres",
      "provider_action": "open_tunnel",
      "action": "tunnel",
      "reason": "matched_network_extension_rule",
      "application_id": "app_dummy_postgres"
    },
    {
      "name": "matched_ssh_upper",
      "provider_action": "open_tunnel",
      "action": "tunnel",
      "reason": "matched_network_extension_rule",
      "application_id": "app_dummy_ssh"
    },
    {
      "name": "explicit_proxy_denied",
      "provider_action": "deny",
      "action": "deny",
      "reason": "no_matching_network_extension_rule",
      "application_id": null
    },
    {
      "name": "wildcard_denied",
      "provider_action": "deny",
      "action": "deny",
      "reason": "invalid_flow_authority",
      "application_id": null
    },
    {
      "name": "ip_literal_denied",
      "provider_action": "deny",
      "action": "deny",
      "reason": "invalid_flow_authority",
      "application_id": null
    },
    {
      "name": "bad_port_denied",
      "provider_action": "deny",
      "action": "deny",
      "reason": "invalid_flow_authority",
      "application_id": null
    },
    {
      "name": "source_bundle_denied",
      "provider_action": "deny",
      "action": "deny",
      "reason": "no_matching_network_extension_rule",
      "application_id": null
    },
    {
      "name": "bad_rules_denied",
      "provider_action": "deny",
      "action": "deny",
      "reason": "invalid_network_extension_rules",
      "application_id": null
    },
    {
      "name": "bad_ip_rules_denied",
      "provider_action": "deny",
      "action": "deny",
      "reason": "invalid_network_extension_rules",
      "application_id": null
    },
    {
      "name": "lifecycle_matched_postgres",
      "provider_action": "open_tunnel",
      "action": "tunnel",
      "reason": "matched_network_extension_rule",
      "provider_lifecycle_status": "running",
      "rules_loaded": true,
      "rule_count": 3,
      "application_id": "app_dummy_postgres"
    },
    {
      "name": "lifecycle_missing_rules_denied",
      "provider_action": "deny",
      "action": "deny",
      "reason": "invalid_network_extension_rules",
      "provider_lifecycle_status": "failed",
      "rules_loaded": false,
      "rule_count": 0,
      "application_id": null
    },
    {
      "name": "lifecycle_escape_ref_denied",
      "provider_action": "deny",
      "action": "deny",
      "reason": "invalid_network_extension_rules",
      "provider_lifecycle_status": "failed",
      "rules_loaded": false,
      "rule_count": 0,
      "application_id": null
    },
    {
      "name": "lifecycle_symlink_escape_ref_denied",
      "provider_action": "deny",
      "action": "deny",
      "reason": "invalid_network_extension_rules",
      "provider_lifecycle_status": "failed",
      "rules_loaded": false,
      "rule_count": 0,
      "application_id": null
    }
  ],
  "runtime_evidence_writer": {
    "status": "ok",
    "runtime_evidence_report": "network_extension_runtime_evidence.json",
    "runtime_installed": true,
    "runtime_running": true,
    "runtime_provider": "transparent_proxy_provider",
    "rules_loaded": true,
    "rule_count": 3,
    "flow_extraction_attempted": 4,
    "flow_extraction_succeeded": 2,
    "flow_extraction_denied": 2,
    "flow_extraction_gate": "ok",
    "flow_attempted": 2,
    "flow_tunneled": 1,
    "flow_denied": 1,
    "atomic_write_gate": "ok",
    "path_guard_gate": "ok",
    "last_error_sanitizer_gate": "ok",
    "secret_leak_gate": "ok"
  },
  "provider_flow_takeover": {
    "status": "ok",
    "provider_superclass": "NETransparentProxyProvider",
    "runtime_provider": "transparent_proxy_provider",
    "compile_only": true,
    "handle_new_flow_return_action": "take_over_matched_flow_live_copy_real_edge_transport_reviewed",
    "flow_copy_review_boundary_required": true,
    "case_count": 11,
    "cases": [
      {
        "name": "provider_matched_postgres_flow_copy_planned",
        "provider_action": "open_tunnel",
        "action": "tunnel",
        "reason": "matched_network_extension_rule",
        "flow_extraction_status": "ok",
        "flow_extraction_reason": "extracted_tcp_host_port",
        "source_bundle_id_present": false,
        "source_bundle_id_trusted": false,
        "accept_flow": true,
        "return_action": "take_over_matched_flow_live_copy_real_edge_transport_reviewed",
        "flow_copy_skeleton_status": "planned",
        "flow_copy_action": "drive_live_runtime_copy_real_edge_transport_configured_reviewed",
        "flow_copy_mode": "tcp_bidirectional_live_copy",
        "flow_copy_implementation": "wired_into_live_handle_new_flow_real_edge_transport_reviewed",
        "flow_copy_review_boundary_required": true,
        "network_extension_flow_opened": false,
        "edge_tunnel_open_started": false,
        "tcp_payload_copy_started": false,
        "flow_payload_read_started": false,
        "flow_payload_write_started": false,
        "guard_contract": "requires_tenant_scope_connection_registry_byte_cap_idle_timeout_close_cleanup_backpressure_before_enablement"
      },
      {
        "name": "provider_empty_source_bundle_flow_copy_planned",
        "provider_action": "open_tunnel",
        "action": "tunnel",
        "reason": "matched_network_extension_rule",
        "flow_extraction_status": "ok",
        "flow_extraction_reason": "extracted_tcp_host_port",
        "source_bundle_id_present": false,
        "source_bundle_id_trusted": false,
        "accept_flow": true,
        "return_action": "take_over_matched_flow_live_copy_real_edge_transport_reviewed",
        "flow_copy_skeleton_status": "planned",
        "flow_copy_action": "drive_live_runtime_copy_real_edge_transport_configured_reviewed",
        "flow_copy_mode": "tcp_bidirectional_live_copy",
        "flow_copy_implementation": "wired_into_live_handle_new_flow_real_edge_transport_reviewed",
        "flow_copy_review_boundary_required": true,
        "network_extension_flow_opened": false,
        "edge_tunnel_open_started": false,
        "tcp_payload_copy_started": false,
        "flow_payload_read_started": false,
        "flow_payload_write_started": false,
        "guard_contract": "requires_tenant_scope_connection_registry_byte_cap_idle_timeout_close_cleanup_backpressure_before_enablement"
      },
      {
        "name": "provider_whitespace_source_bundle_flow_copy_planned",
        "provider_action": "open_tunnel",
        "action": "tunnel",
        "reason": "matched_network_extension_rule",
        "flow_extraction_status": "ok",
        "flow_extraction_reason": "extracted_tcp_host_port",
        "source_bundle_id_present": false,
        "source_bundle_id_trusted": false,
        "accept_flow": true,
        "return_action": "take_over_matched_flow_live_copy_real_edge_transport_reviewed",
        "flow_copy_skeleton_status": "planned",
        "flow_copy_action": "drive_live_runtime_copy_real_edge_transport_configured_reviewed",
        "flow_copy_mode": "tcp_bidirectional_live_copy",
        "flow_copy_implementation": "wired_into_live_handle_new_flow_real_edge_transport_reviewed",
        "flow_copy_review_boundary_required": true,
        "network_extension_flow_opened": false,
        "edge_tunnel_open_started": false,
        "tcp_payload_copy_started": false,
        "flow_payload_read_started": false,
        "flow_payload_write_started": false,
        "guard_contract": "requires_tenant_scope_connection_registry_byte_cap_idle_timeout_close_cleanup_backpressure_before_enablement"
      },
      {
        "name": "provider_denied_route_flow_copy_closed",
        "provider_action": "deny",
        "action": "deny",
        "reason": "no_matching_network_extension_rule",
        "flow_extraction_status": "ok",
        "flow_extraction_reason": "extracted_tcp_host_port",
        "source_bundle_id_present": false,
        "source_bundle_id_trusted": false,
        "accept_flow": false,
        "return_action": "deny_closed_no_copy",
        "flow_copy_skeleton_status": "deny_closed",
        "flow_copy_action": "deny_closed_no_copy",
        "flow_copy_mode": "none",
        "flow_copy_implementation": "not_started",
        "flow_copy_review_boundary_required": true,
        "network_extension_flow_opened": false,
        "edge_tunnel_open_started": false,
        "tcp_payload_copy_started": false,
        "flow_payload_read_started": false,
        "flow_payload_write_started": false,
        "guard_contract": "requires_tenant_scope_connection_registry_byte_cap_idle_timeout_close_cleanup_backpressure_before_enablement"
      },
      {
        "name": "provider_invalid_authority_flow_copy_closed",
        "provider_action": "deny",
        "action": "deny",
        "reason": "invalid_flow_authority",
        "flow_extraction_status": "denied",
        "flow_extraction_reason": "invalid_flow_authority",
        "source_bundle_id_present": false,
        "source_bundle_id_trusted": false,
        "accept_flow": false,
        "return_action": "deny_closed_no_copy",
        "flow_copy_skeleton_status": "deny_closed",
        "flow_copy_action": "deny_closed_no_copy",
        "flow_copy_mode": "none",
        "flow_copy_implementation": "not_started",
        "flow_copy_review_boundary_required": true,
        "network_extension_flow_opened": false,
        "edge_tunnel_open_started": false,
        "tcp_payload_copy_started": false,
        "flow_payload_read_started": false,
        "flow_payload_write_started": false,
        "guard_contract": "requires_tenant_scope_connection_registry_byte_cap_idle_timeout_close_cleanup_backpressure_before_enablement"
      },
      {
        "name": "provider_unsupported_transport_flow_copy_closed",
        "provider_action": "deny",
        "action": "deny",